307951383619981312,"('fort dodge, ia', 'united states')",international ,"[42.48643293, -94.2032813]",mountain time (us & canada),,pacstar_e,why them gary niggas so reckless doe hahaha...shit got me rolling
307951383871643650,"('gresham, or', 'united states')",figi,"[45.50868496, -122.42924835]",pacific time (us & canada),['ifonly'],natalia_ilrb,"i wish i was a dog or cat, i wouldn't have to go to school and i could sleep all day. #ifonly"
307951383770959872,"('hartlepool, hartlepool', 'united kingdom')",hartlepool,,london,,emmajcrowe,realising you have a lot more money than you thought you did is legitimately the best feeling ever
307951384236539905,"('new york, us', 'united states')","troy, ny","[44.68691458, -73.49059867]",central time (us & canada),,kareee,"of course we run into them, i have the worst luck"
307951384345604098,"('kankakee, il', 'united states')",deep sea diving in #oomf,"[41.115596, -87.84994052]",central time (us & canada),,vaughn_assafool,@charlieehall28  wyo
307951384307851265,"('new york, us', 'united states')","canandaigua, ny","[42.8753752, -77.3251833]",atlantic time (canada),['shitemilysays'],zereksmith,i feel like i have a baby in my stomach but my baby is powerade #shitemilysays
307951384618225664,"('round rock, tx', 'united states')","austin, tx","[30.52716502, -97.63071299]",central time (us & canada),['carshow'],mzjunezworld,my fave #carshow @ the dell diamond http://t.co/deamach8ib
307951386665025536,"('lima, ny', 'united states')",,"[42.9112775, -77.6182151]",quito,,dereklevendusky,"@mikekimtv @evanthorpe @jeffreyparshall oh, and no more racist jokes after watching you blow up @peterjdonato. i'm scared of you now."
307951386518253570,"('pauma valley, ca', 'united states')",,"[33.3191452, -117.1554822]",arizona,,emilia_amoreno,that's pig latin itchbe
307951387004768256,"('elkhart, in', 'united states')",,"[41.69263923, -85.98948766]",pacific time (us & canada),,yelah_muabsun,it was goood to keep me guessin cause you know i hate attention
307951385918443521,"('preston, lancashire', 'united kingdom')",west sussex,"[53.77361482, -2.71042694]",london,"['beers', 'bath', 'chilled']",jashman93,doesn't get much better than this  #beers #bath #chilled http://t.co/ezvuaypdlu
307951387059314689,"('queens, ny', 'united states')","queens, ny","[40.734516, -73.773995]",central time (us & canada),"['fitness', 'running', 'workout']",jayresc,"5 mile in the cold is no joke. #fitness #running #workout @ fresh meadows, ny http://t.co/wq5hjyq1wd"
307951387432599553,"('newport news, va', 'united states')",virginia beach,"[37.14549393, -76.57227469]",eastern time (us & canada),,biglilaaron,@nicdoma @asyellow i'm not gonna wager against you bc your bad luck will rub off on me.
307951387310968832,"('paradise, nv', 'united states')","keller, tx","[36.11249811, -115.17571357]",central time (us & canada),,jacobpwhitaker,chinese new year at the bellagio. @ bellagio hotel &amp; casino http://t.co/f1a1myyiv6
307951387529080832,"('dearborn heights, mi', 'united states')",dearborn heights,"[42.2697616, -83.2395216]",none,,akristeen69,not putting this all over twitter.
307951387537448961,"('irving, tx', 'united states')",tejas motherfuckkkas,"[32.91989692, -97.00198102]",hawaii,,batmandaah,@xjrokx but uh don't tell him i told you....uhh just like accidentally confuse it for your...shoe and take it
307951386983800832,"('california, us', 'united states')",pnw,"[38.73229167, -121.34493056]",none,,geoff209,then back up to seattle for suppy with @clarkxfrey maybe see that stud @chadderxcheese there
307951387872989184,"('bandar kuala lumpur, kuala lumpur', 'malaysia')",malaysia,,kuala lumpur,,adamalfee,2 more days for naruto shippuden - ultimate ninja storm 3!! awesome-weiii!! http://t.co/wechznkuhu
307951388011405313,"('brockton, ma', 'united states')"," brockton, ma.",,eastern time (us & canada),,jj73cuda,great two on one!!!!!!!
307951388279836673,"('san diego, ca', 'united states')",san francisco,"[32.90424759, -117.24494258]",pacific time (us & canada),,tinatrant,post-hike reward/dad's bday lunch :) @ the grill at torrey pines http://t.co/fe3pntx3mc
307951388481163264,"('rosemont, ca', 'united states')","sacramento, ca","[38.53905772, -121.35816745]",arizona,,mrchief916,@findthemhot22 @toddweberguitar difference is balmer hansen will stick around and get exspansion.  they didn't expect a fight like this
307951390687387649,"('conway, sc', 'united states')","mo, new jersey","[33.80175652, -79.00829946]",eastern time (us & canada),,kelseastevens,"""there was a camel out here earlier""....oh tyler @bobbycruz56"
307951390792228865,"('garfield, nj', 'united states')",nuff' said. ,"[40.877761, -74.0959]",none,,tayloorjeann,"ihy, you lazy piece of shit."
307951390859345920,"('trenton, mi', 'united states')",michigan,"[42.1303265, -83.204638]",central time (us & canada),,juliawilliamsxo,@kristinoshinsky we need to go to zorbas too!
307951391203278850,"('seattle, wa', 'united states')","seattle, wa","[47.65284369, -122.34508396]",pacific time (us & canada),,stevenwex,"finally got out of bed. big progress today, guys."
307951391710781440,"('san marcos, ca', 'united states')",,"[33.1337639, -117.2062018]",none,"['subway', 'eatfresh']",jessandrade147,watch me finish this entire foot long #subway #eatfresh
307951391769501697,"('kane, ia', 'united states')",iowa,"[41.25039518, -95.90200245]",central time (us & canada),,kelseyybrianna,my mom is the worst driver ive ever met
307951392046338048,"('manhattan, ny', 'united states')",the city,,eastern time (us & canada),,ues_bella,@redteknique if i drank scotch i would definitely try that.
307951392079900672,"(""lee's summit, mo"", 'united states')",out blazin',"[38.92628758, -94.34929367]",quito,,abuurb,no words can describe the amount of hate i have for jenele. be a fucking mother.
307951391970844672,"('santa ana, ca', 'united states')",santa ana (:,"[33.76575458, -117.86891039]",central time (us & canada),,sammysantoyo18,@karinac2353 it makes me mad why couldn't she just keep me
307951392214093824,"('des moines, ia', 'united states')",united states,"[41.62364602, -93.67217481]",central time (us & canada),['amazing'],lac0025,lunch at saints and watching the game. can't get any better than that for a beautiful saturday. #amazing
307951392537055232,"('nuneaton and bedworth, warwickshire', 'united kingdom')",,"[52.53406537, -1.43866462]",casablanca,['dancingpony'],soffia19,love the new 3 advert #dancingpony
307951392822263809,"('', '')",in my appartment lol,"[5.5700269, -0.2186781]",london,,lugu_darlyn,"""oh cha how we for do am @they_kalme_stan: @lugu_darlyn eeeeeeiii adowarim den trotro...smh"""
307951395137519616,"('nampa, id', 'united states')","nampa, idaho",,mountain time (us & canada),,carlnorman,@thereal_jpl thanks for the rt!
307951394793598976,"('bethesda, md', 'united states')","bethesda, maryland","[38.99211883, -77.09688875]",eastern time (us & canada),,wrinkledsilk,there's a lot of hairspray in my hair. keep me away from an open flame http://t.co/l6wbenplyx
307951395875741696,"('muskegon, mi', 'united states')",231 muskegon mi,"[43.22789669, -86.21375084]",none,,kennyboi231,"i swear she is a hypocrite. i get bitched at for ""assuming"" things but she can?"
307951396081262592,"('el paso, tx', 'united states')",in your heart or on your mind~,"[31.7888389, -106.4273563]",mountain time (us & canada),,giovanna721,boo @aprila756 for protecting your account i tried to retweet you &gt;.&lt;
307951396098019328,"('warner robins, ga', 'united states')",wartown. ,"[32.6450693, -83.64606997]",atlantic time (canada),,hannahgenesis_,@skatephantom with what kennnnu
307951396358078464,"('new york, us', 'united states')",saratoga springs,"[42.76494289, -73.76055856]",none,,rfrasier93,"i'll be your next boyfriend taylor swift , i got you"
307951396551016448,"('kempton park, gauteng', 'south africa')",south africa,"[-26.10387, 28.22561]",none,,nkosinathir,@booty_young ok we'll talk
307951396718800896,"('norfolk, ma', 'united states')","boston, ma","[42.09299403, -71.31769571]",none,,kevinpwinter,that lil ball of hate!!!!!!   eff yeah!
307951396739747841,"('ortonville, mi', 'united states')",ortonville/allendale,"[42.84644387, -83.44849085]",quito,,_christinajulia,@kristsarniak @ambercullison @mck_j i was just out that way at target!
308740315169316864,"('central pasco, fl', 'united states')",,"[28.20982303, -82.37258596]",none,,mdriosss,"it doesn't matter who hurt you, or who broke you down, what matters is who made you smile again."
308740315232219136,"('rancho cordova, ca', 'united states')",rosemont,"[38.54585171, -121.2749691]",hawaii,,jakkidesantis,@bcgwmf it's fade on side for tht lil niggg
308740315450331136,"('turlock, ca', 'united states')",turlock,"[37.51371821, -120.84873535]",pacific time (us & canada),,running_kaleb,@lucidemma wow you would. i got ice cream instead!
308740315748106240,"('uhrichsville, oh', 'united states')",garrettsville,"[40.39125543, -81.34625453]",central time (us & canada),,stephj2518,"i can't find the place your heart is hiding, and i'm no quitter but i'm tired of fighting"
308740315945254912,"('nashville, tn', 'united states')",,"[36.19491718, -86.73543011]",eastern time (us & canada),,_soccer_bby14,@ayooankely yeah on monday &amp;&amp; away game.
308740316100444160,"('new madrid, mo', 'united states')",new madrid ,"[36.5899578, -89.5241634]",eastern time (us & canada),,tunechi_a1,@megcraft2 rite. but wyd
308740316117204993,"('waimalu, hi', 'united states')",,"[21.38767417, -157.93991183]",hawaii,,daaamnmaddien,i need to get lighter before prom comes around
308740316301783041,"('berlin, berlin', 'deutschland')",berlin-tempelhof,"[52.3967906, 13.4037575]",berlin,,raf2attac,the minimum wage harms the most vulnerable - http://t.co/carq4wblzy
308740316679254018,"('', '')","csjdm, bulacan","[14.7933581, 121.0631373]",hawaii,,yvonnepalaganas,hi @tweetnirizal have you tried @greensnberries?this healthy juice drink will give you the energy you need to combat pollution and pagod! :d
308740318432481280,"('new york, ny', 'united states')","brooklyn, ny","[40.6836247, -73.9076269]",central time (us & canada),,bkbanging,@natalietarchick ya exactly i'm not a lil pussy and you enjoy my phone calls
308740318625406977,"('pine hills, fl', 'united states')",orlando/ baghdad,"[28.57835921, -81.45146206]",central time (us & canada),,bfpgetemj,my son son getting a latenight piff up @ barber kings &amp; beauty queens http://t.co/f5rwzisgvk
308740318549929984,"('pesanggrahan, jakarta selatan', 'indonesia')","jakarta, indonesia","[-6.23222, 106.76291]",none,['aquarius'],fati_bun,"""@ratuweetha : an #aquarius needs a certain amount of detachment from others to stay in touch with their own sanity."""
308740318650568704,"('coventry, coventry', 'united kingdom')",coventry & northampton,"[52.39314871, -1.49342674]",london,,jessharvey1991,mayday down now on to broadchurch. i'm like a 40 year old woman.
308740317987872768,"('columbus, oh', 'united states')",,,eastern time (us & canada),,gamer_4768,@ayowhitneey_ dang ! whitney say's no to them thirst niggas ! (;
308740318822559744,"('laguna hills, ca', 'united states')",la and oc,"[33.62720153, -117.74195872]",pacific time (us & canada),,young_maymay,@abbywaxenberg @daggy1 rates rose 110% from 2005-2007 rates have been rising regardless or there wouldn't have been a need for reform
308740318898057216,"('delaware, us', 'united states')","felton, delaware","[39.01420186, -75.63307012]",none,,builtsteeletuff,and i float above a shallow bay. lift me up until the ground gives way.
308740318931607552,"('loma linda, ca', 'united states')",,"[34.04936817, -117.24395067]",none,,ayeee_sanch,i missed these ratchets :)#boba#milktea mysallywally @ boba tea house http://t.co/q9jbhb363p
308740319086796801,"('long branch, nj', 'united states')",,"[40.30941352, -73.98528208]",atlantic time (canada),,2much_swag,@beautyaddicted_ oops my fault lol
308740319258759169,"('huntington beach, ca', 'united states')",brazil,,greenland,,todateame3,@drewchadwicke3 drew's fine like the red wine stuck to my lips maybe he can help get his follow with a kiss
308740319439101952,"('luton, luton', 'united kingdom')",luton,"[51.90648034, -0.41096932]",casablanca,,xbethanydaniels,it will be out the window soon if i'm not asleep
308740319661420546,"('round rock, tx', 'united states')","austin, tx","[30.5394171, -97.66307232]",eastern time (us & canada),,homesatxsale,congrats to @spbwy and @chapyg on the purchase of their new home in teravista. here's to many happy memories!
308740319812395009,"('fort worth, tx', 'united states')",,"[32.78979268, -97.36676644]",none,,angelicaibarr16,@dat_wizard  miss you at work bro lol its no the same without you and @09palosr
308740320080850944,"('hartford, ct', 'united states')",,"[41.7342678, -72.68876118]",none,,sasha_nakeyute,how to make money quick?
308740320135352321,"('durham, nc', 'united states')",everywhere your girl is,"[35.9757776, -78.8976965]",quito,,_grindation,turn down for what
308740322819710976,"('columbus, oh', 'united states')",o-h-i-o buckeye state via nj,"[39.93175996, -83.1271787]",none,,_red31,red's got that meat!
308740323239137280,"('cleveland, oh', 'united states')",notre dame college,"[41.49510949, -81.63855848]",pacific time (us & canada),,ishef,lol oh you favorited it and everything!!
308740323750862848,"('houston, tx', 'united states')",cloud 9,"[29.75358305, -95.34976827]",hawaii,,hellokittyylova,here in downtown (:
308740323696328704,"('mountain view, ca', 'united states')","las vegas, nv, usa","[37.4215444, -122.08872875]",pacific time (us & canada),,dendro,no a380 at sfo this afternoon :(
308740324036063232,"('vail, co', 'united states')",,"[39.64419438, -106.38888887]",none,,boosecasey,if you only listen to the vocals on thanks for memories by fall out boy your heart will melt.
308740323838935040,"('york, ontario', 'canada')","toronto, ontario","[43.7828687, -79.62761879]",eastern time (us & canada),"['hurdleovercome', 'operationnewoldbody']",vito13,it's back to being a habit! #hurdleovercome #operationnewoldbody (@ goodlife fitness) http://t.co/rbouwe9pdj
308740325009141760,"('anaheim, ca', 'united states')",california ,"[33.83477487, -117.94954045]",pacific time (us & canada),,yaarieee,my lrt it's the truth
308740326695260161,"('hulu kinta, kinta', 'malaysia')","tawau, sabah",,kuala lumpur,,mrericlly,early morning start again meh.... = =
308740326401642497,"('', '')","progreso, yucatan ","[0.0, 0.0]",mountain time (us & canada),['confesioneseverywhere'],adriasuarez,#confesioneseverywhere !! jajaja http://t.co/kchwklgas0
308740327555076096,"('beverly hills juice, los angeles', 'united states')","los angeles/reading, england","[34.0759865, -118.37289384]",pacific time (us & canada),,paulinethelimey,yum (@ beverly hills juice club) http://t.co/mykweyqjkp
308740327697678337,"('danville, il', 'united states')",danville,"[40.14482676, -87.60090737]",mountain time (us & canada),,__xxxxxxxxxxxx,@stephyogameup in your aviiii there's 2 of you.
308740327622180864,"('perry, in', 'united states')","indianapolis,indiana ","[39.65562189, -86.18291642]",none,,krissy_luvsyou,@songsofkidrauhl yep and i'm glad justin sees us as fam(ily) too &lt;3 :)
308740328154873856,"('new york, ny', 'united states')",cool side of hell with reyanna,"[40.69558931, -73.98838328]",eastern time (us & canada),,becoolhowubcool,so what's the difference between a single girl that has sex with 20 men and a female who been in 20 relationships and had sex with all 20?
308740328234561536,"('dallas, tx', 'united states')",my dreams~,"[32.7367022, -96.6504212]",central time (us & canada),,squishyyoucunt,one huge mistake you can make is having someone feel like they have to compete for your attention.
308740327508959232,"('marcon, venice', 'italy')",paris,"[45.5496595, 12.3000573]",none,,thekoobs,don't come to my backyard ok:-):-):-):-):-) http://t.co/dpwqyu5nfu
308740328452681729,"('', '')",,"[18.2950063, 42.7576532]",hawaii,,mismoon14,"""@prince5100: @@hanialimoqbel http://t.co/tqbilgh8ub"""
308740328393953281,"('scottsbluff, ne', 'united states')",nebraska,"[41.8620192, -103.662027]",none,['weirdos'],melyndadoremus,my neices are crazy goofy #weirdos
308740328565907457,"('chicopee, ma', 'united states')",bikini bottommmm ,"[42.17363834, -72.61547661]",hawaii,['loner'],pornandbreezy,"wow , steven is suspended &amp; i have to eat breakfast alone again -.- #loner"
308740328704331776,"('', '')",london,"[10.699874, -61.553881]",london,,jahriv,i'm at al's diner (port of spain) [pic]: http://t.co/bd8incho96
308740328737873920,"('wichita, ks', 'united states')",,"[37.66895187, -97.31750339]",central time (us & canada),,thatboywill_yum,too bad kansas has a sucky football team id love to go there
308740328737882114,"('monmouthshire, monmouthshire', 'united kingdom')","london, uk",,london,,johnboy_cook,"@ciaranmurray592 oh no!  it's like losing a part of the soul, we cling on as long as we can..."
308740331334152192,"('south portland, me', 'united states')","portland, maine","[43.6580074, -70.2414053]",central time (us & canada),,rileyliz,@judes5375 i wish i was.  and what's worse ...it was good!  vodka does that i guess.
308740331527102464,"('everett, ga', 'united states')",,"[31.26852752, -81.43114383]",eastern time (us & canada),,mattgolden34,my dad always had to be a jokester
308740331418038272,"('eugene, or', 'united states')","eugene, oregon","[44.09555638, -123.05241451]",pacific time (us & canada),,emolivos,kalama lawmaker walks back claim cyclists polluting air with heavy breathing http://t.co/bswlcwv5xv and here i thought i was doing good!
308740331732627456,"('lisbon falls, me', 'united states')",,"[44.00351655, -70.06087162]",arizona,,lexi_royy,why people try fighting with me on working out is outrageous
308740331711643649,"('coldwater, oh', 'united states')",,"[40.4868035, -84.6406439]",pacific time (us & canada),,ref014,@14mpm i hope she falls in a hole
308740332017831937,"('kentucky, us', 'united states')",around da way ky (;,"[36.9612081, -86.3980952]",central time (us & canada),,badasscre,sweet baby jesus on sunday morning.. this food is about to get me right!
308740331795542017,"('hilo, hi', 'united states')",,"[19.71198925, -155.0821502]",alaska,,neto__19,i fucked her once and never fuck her again!
308740332609236992,"('wayne, in', 'united states')",indiana,"[39.8224285, -86.2911682]",arizona,,itscusimmiixed_,"i remember when , we could cuddle all night &gt;&gt;&gt;&gt;"
308740332688916481,"('southampton, southampton', 'united kingdom')",kent/ southampton ,"[50.91826248, -1.3952148]",amsterdam,,_taragrimes,the main 2 things on my mind whilst at work are nandos and how ugly everyone is
308740332881842176,"('palatka, fl', 'united states')",,"[29.6562818, -81.66081047]",none,,darianrobinson1,ppl to weak to follow their own dreams will always find ways to discourage yours ...never give up
308740332948955136,"('calcasieu ball room, new orleans', 'united states')",boston / new orleans,"[29.942277, -90.067355]",eastern time (us & canada),,soundadvice,"glen david just showed some out of towners, ""what it means"". thanks to @sara422 for the opportunity. (@ calcasieu) http://t.co/yrx79eelkm"
308740333058007040,"('peoria, il', 'united states')",thats classified..,"[40.7328175, -89.6458225]",none,,brad_waffles,lol your butt is the flattest :)
308740334861561856,"('charlottesville, va', 'united states')",va,,hawaii,,x_cyndi,"@ariel__ramos you know that was actually a great comeback! ahhh shit i'm proud, my little brown boy is growing up!"
308740335369072640,"('centerport, pa', 'united states')","centerport, pa","[40.48531108, -76.00649484]",arizona,,courbren,@mclydon8 woooord!? it's like that though?
308740336027586560,"('milwaukee, wi', 'united states')",future l.a resident ,"[43.1785649, -88.02722947]",central time (us & canada),,septemberhiqh,i love how my face ain't got not one bump..unless some dirty finger bitch touch it -_______-
308740336140820480,"('louisiana, us', 'united states')",,"[29.94758491, -92.16642181]",none,['taylorbroussardproblems'],20mjv09,@taayyyylooorrr lmao i'm trying to make #taylorbroussardproblems trend
308740336149209088,"('mill plain, wa', 'united states')","vancouver, wa","[45.61759435, -122.47898305]",pacific time (us & canada),,schlueterbooter,@kierra_2rawww why would you want to publicly display something like this
308740336178585601,"('pesanggrahan, jakarta selatan', 'indonesia')",nkri,"[-6.2512758, 106.7555079]",pacific time (us & canada),,arief_anagkuat,are you ready for today?
308740336388276224,"('grand prairie, tx', 'united states')","dfw, texas","[32.65136559, -97.0218212]",central time (us & canada),,lesliedevereaux,@coltongalbraith you should feel honored that you were chosen.
308740336505737216,"('', '')",,"[8.21015894, 124.24239064]",taipei,['breakfast'],koykokix,"#breakfast recovery mode @ laville bara-as, iligan http://t.co/45fjrqdklc"
308740336749006848,"('affton, mo', 'united states')",fml.,"[38.5415431, -90.3072883]",none,,thewardennn,"""@sexy_and_bitchy: omg. that looks painful. http://t.co/j8i6mbalbc"" i want to do that! @adog241 put it on the bucketlist. hahaha"
308740336765779971,"('great yarmouth, norfolk', 'united kingdom')",great yarmouth,"[52.601528, 1.727952]",london,['capow'],the6edwards,watch this real news about a real batman handing in a criminal in bradford #capow bash wholop http://t.co/twvs1enfn3
308740339345289217,"('round lake beach, il', 'united states')",,"[42.3749299, -88.063383]",none,,btoothet,breaking news: snow day tomorrow no lie!
308740339567579136,"('clarksville, in', 'united states')",south i,"[38.37897872, -85.78657206]",none,,buddy_mac2324,@my_dougie_22 @ben_allen12 wow. politics man. that's all fc is about.
308740339697598464,"('strongsville, oh', 'united states')",cle,"[41.33980113, -81.80886517]",eastern time (us & canada),"['cavs', 'justkidding', 'gocavs', 'uncleluke', 'uncledrew']",jfdurk_cle,all i can take away from this first half is that #cavs are better when boobie plays. #justkidding #gocavs #uncleluke #uncledrew
308740339555000320,"('south carolina, us', 'united states')",,,pacific time (us & canada),,imake_hercum_,@trustnoniggaaa nah i ain't mean to tweet you that ...
308740339961851904,"('seymour, tn', 'united states')",,"[35.86346117, -83.7487753]",mountain time (us & canada),,juliecreell,making a vine in the shower
308740340238647296,"('east dunbartonshire, east dunbartonshire', 'united kingdom')",glasgow ,"[55.94724754, -4.11964464]",casablanca,"['idea', 'plan']",mrsclaramac,@pcraven96 @adriannemurphy its my 21st soon can i get a freddo? you's can chip in and maybe ask @daviethedj to play my fav song..#idea #plan
308740340297367553,"('jacksonville, fl', 'united states')",poundtown,,atlantic time (canada),['initialsofsomeoneyoucareabout'],asapmuffcat,#initialsofsomeoneyoucareabout jc jesus christ or jan christofur
308740340330946560,"('denver, co', 'united states')",,"[39.75225873, -104.96861164]",central time (us & canada),,xandriabetty,@domvisions ummmm i don't even know how to start responding to this! :)
308740340427390976,"('brighton, mi', 'united states')",michigan,"[42.54027174, -83.78256661]",eastern time (us & canada),,kristiegnar,i hate it when i listen to @everytimeidie in the car and i end up going 95 without realizing it.
308740340796514304,"('lawndale, ca', 'united states')",,"[33.87895038, -118.3563697]",arizona,,sabrinatho,i'm activated on friday .  just to tell te homies something lol
308740340691640322,"('london, england', 'united kingdom')","london, uk",,london,,mikewarburton,@jennifer_daley go see the curious incident of the dog in the night-time! if i'm wrong &amp; you don't love it i'll go see wicked the musical!
308740341262061569,"('warrington, warrington', 'united kingdom')",warrington,"[53.39273859, -2.62169741]",london,,goodbyeandgo,also wondering what possessed me to book train tickets for 7.30am to go to edinburgh next thursday?! clearly think i don't need sleep.
308740341304020993,"('hagerstown, md', 'united states')",,"[39.6544452, -77.7170051]",none,,smile_sammi,forever holla if ya ever need mee.
308740341308215297,"('georgia, us', 'united states')",,"[34.03823104, -84.69124172]",eastern time (us & canada),,itsdonallen,@carriekeagan @gillianjacobs will undoubtedly be disappointed the shoe cam is gone. she pioneered it.
308740341404667904,"('waterloo, ontario', 'canada')","paris, france","[43.4267, -80.48189]",atlantic time (canada),,lambert_cheryl,daughter is moving to toronto in 2....should i follow?
308740341501140992,"('seymour, tn', 'united states')","sevierville, tennessee","[35.88317743, -83.76265269]",eastern time (us & canada),,jamsmokearoach,@joslinconnatser at least it is the last week til spring break (:
308740343480852480,"('leicester, leicester', 'united kingdom')","east midlands, uk","[52.62438453, -1.15304227]",london,,nickfitz,"whenever one uses gimp on a mac, one wonders whether any of the developers ever actually tested the use of it for its intended purposes."
308740343543767041,"('los angeles, ca', 'united states')","los angeles, california ","[34.21852069, -118.57847437]",pacific time (us & canada),,m_andrewww,idk why i used to hate cigs. they're bomb
308740343355039744,"('phoenix, az', 'united states')",,"[33.4345203, -111.99930336]",none,,profpmj,"@andyburnhammp so the last time you said it you were lying? an admirable admission. that said, i never believed a word you said anyway."
308740343740915712,"('claiborne, la', 'united states')",w/ kathryn.,"[32.51167553, -92.20858118]",central time (us & canada),,1oorvre,"bitches be like ""i got haters"" but got only 33 followers with 12466 following! bitch who hating!"
